{
  "$schema": "./_manifest.schema.json",
  "platform": "claude-code",
  "displayName": "Claude Code",
  "outputDir": ".claude",
  "fileMap": {
    "agents":       { "dir": "agents",       "ext": ".md" },
    "commands":     { "dir": "commands",     "ext": ".md" },
    "instructions": { "dir": "rules",        "ext": ".md" },
    "skills":       { "dir": "skills",       "preserveTree": true }
  },
  "frontmatter": {
    "agents": {
      "tools": "string",
      "mcpToolNames": "verbatim",
      "keepKeys": ["name", "description", "tools"],
      "toolMap": {
        "read": "Read",
        "search": "Read",
        "edit": "Edit, Write",
        "execute": "Bash",
        "agent": "Agent",
        "web": "WebFetch, WebSearch",
        "todo": "TodoWrite"
      }
    },
    "commands": {
      "keepKeys": ["description", "argument-hint"]
    },
    "instructions": {
      "renameKeys": { "applyTo": "paths" },
      "keepKeys": ["description", "paths"]
    },
    "skills": {
      "keepKeys": ["name", "description"]
    }
  },
  "mcp": {
    "tags": ["core", "extended"],
    "outputFile": "../.mcp.json",
    "format": "claude-code"
  }
}
